{
  "name": "ynh-dev",
  "version": "0.13.1",
  "description": "Contribute to ynh itself: architecture, vendor adapters, ynd commands, capability bumps, evals and the release procedure.",
  "author": {
    "name": "eyelock",
    "url": "https://github.com/eyelock"
  },
  "keywords": [
    "ynh",
    "development",
    "contributing"
  ]
}
