{
  "name": "ynh-guide",
  "version": "0.12.1",
  "description": "Adopt, build, compose, gate and troubleshoot AI harnesses. Eight skills and three agents, useful whether or not ynh is installed.",
  "author": {
    "name": "eyelock",
    "url": "https://github.com/eyelock"
  },
  "keywords": [
    "harness",
    "ai",
    "skills",
    "agents"
  ]
}
